ball,Commentary Text,innings,match_no,team_a,team_b,team_a_11,team_b_11,team_a_subs,team_b_subs,series,season,venue,date,toss,winner,player_of_the_match,toss_winner,toss_choosen
 12.6 ," Johnson to Chris Morris, no run, the slower slanter to end the spell. A checked drive follows to extra cover. Ends a comeback spell ",DC Inns,25t,Mumbai Indians,Delhi Capitals,"Mumbai Indians (Playing XI): Parthiv Patel(w), Jos Buttler, Nitish Rana, Rohit Sharma(c), Hardik Pandya, Kieron Pollard, Krunal Pandya, Mitchell Johnson, Harbhajan Singh, Mitchell McClenaghan, Jasprit Bumrah",,,,IPL,2017,"Wankhede Stadium,Mumbai","Apr 22,2017",Delhi Daredevils have won the toss and have opted to field,Mumbai Indians won by 14 runs,Mitchell McClenaghan,DD,field
 12.5 ," Johnson to Rabada, 1 run, on the hips. Turned away with a jumpy shuffle around the corner ",DC Inns,25t,Mumbai Indians,Delhi Capitals,"Mumbai Indians (Playing XI): Parthiv Patel(w), Jos Buttler, Nitish Rana, Rohit Sharma(c), Hardik Pandya, Kieron Pollard, Krunal Pandya, Mitchell Johnson, Harbhajan Singh, Mitchell McClenaghan, Jasprit Bumrah",,,,IPL,2017,"Wankhede Stadium,Mumbai","Apr 22,2017",Delhi Daredevils have won the toss and have opted to field,Mumbai Indians won by 14 runs,Mitchell McClenaghan,DD,field
 12.5 ," Johnson to Rabada, wide, takes pace off the ball but loses his radar in the process. Down leg ",DC Inns,25t,Mumbai Indians,Delhi Capitals,"Mumbai Indians (Playing XI): Parthiv Patel(w), Jos Buttler, Nitish Rana, Rohit Sharma(c), Hardik Pandya, Kieron Pollard, Krunal Pandya, Mitchell Johnson, Harbhajan Singh, Mitchell McClenaghan, Jasprit Bumrah",,,,IPL,2017,"Wankhede Stadium,Mumbai","Apr 22,2017",Delhi Daredevils have won the toss and have opted to field,Mumbai Indians won by 14 runs,Mitchell McClenaghan,DD,field
 12.4 ," Johnson to Chris Morris, 1 run, the full sucker delivery. Weaves it past the bowler with the bat sticker being shown to the cameras ",DC Inns,25t,Mumbai Indians,Delhi Capitals,"Mumbai Indians (Playing XI): Parthiv Patel(w), Jos Buttler, Nitish Rana, Rohit Sharma(c), Hardik Pandya, Kieron Pollard, Krunal Pandya, Mitchell Johnson, Harbhajan Singh, Mitchell McClenaghan, Jasprit Bumrah",,,,IPL,2017,"Wankhede Stadium,Mumbai","Apr 22,2017",Delhi Daredevils have won the toss and have opted to field,Mumbai Indians won by 14 runs,Mitchell McClenaghan,DD,field
 12.3 ," Johnson to Chris Morris, FOUR, brings up the 50 of the stand. A real fightback this. And gets there in some style as well with a lovely looking square cut. Guess what, there is no one out there ",DC Inns,25t,Mumbai Indians,Delhi Capitals,"Mumbai Indians (Playing XI): Parthiv Patel(w), Jos Buttler, Nitish Rana, Rohit Sharma(c), Hardik Pandya, Kieron Pollard, Krunal Pandya, Mitchell Johnson, Harbhajan Singh, Mitchell McClenaghan, Jasprit Bumrah",,,,IPL,2017,"Wankhede Stadium,Mumbai","Apr 22,2017",Delhi Daredevils have won the toss and have opted to field,Mumbai Indians won by 14 runs,Mitchell McClenaghan,DD,field
 12.2 ,"Johnson to Chris Morris, no run, friendly fire. An angry smash back this from Morris, finds his partner mid-way though. Who takes the blow in the unprotected area on his leg. Some bruises are bound to show up in the morning",DC Inns,25t,Mumbai Indians,Delhi Capitals,"Mumbai Indians (Playing XI): Parthiv Patel(w), Jos Buttler, Nitish Rana, Rohit Sharma(c), Hardik Pandya, Kieron Pollard, Krunal Pandya, Mitchell Johnson, Harbhajan Singh, Mitchell McClenaghan, Jasprit Bumrah",,,,IPL,2017,"Wankhede Stadium,Mumbai","Apr 22,2017",Delhi Daredevils have won the toss and have opted to field,Mumbai Indians won by 14 runs,Mitchell McClenaghan,DD,field
 12.1 ," Johnson to Chris Morris, 2 runs, on a back of a length slanting across. A back footed punch through the covers ",DC Inns,25t,Mumbai Indians,Delhi Capitals,"Mumbai Indians (Playing XI): Parthiv Patel(w), Jos Buttler, Nitish Rana, Rohit Sharma(c), Hardik Pandya, Kieron Pollard, Krunal Pandya, Mitchell Johnson, Harbhajan Singh, Mitchell McClenaghan, Jasprit Bumrah",,,,IPL,2017,"Wankhede Stadium,Mumbai","Apr 22,2017",Delhi Daredevils have won the toss and have opted to field,Mumbai Indians won by 14 runs,Mitchell McClenaghan,DD,field
 11.6 ," Harbhajan to Rabada, no run, leans deep inside the crease and stands solidly in defence ",DC Inns,25t,Mumbai Indians,Delhi Capitals,"Mumbai Indians (Playing XI): Parthiv Patel(w), Jos Buttler, Nitish Rana, Rohit Sharma(c), Hardik Pandya, Kieron Pollard, Krunal Pandya, Mitchell Johnson, Harbhajan Singh, Mitchell McClenaghan, Jasprit Bumrah",,,,IPL,2017,"Wankhede Stadium,Mumbai","Apr 22,2017",Delhi Daredevils have won the toss and have opted to field,Mumbai Indians won by 14 runs,Mitchell McClenaghan,DD,field
 11.5 ," Harbhajan to Rabada, no run, a futile shout. Thanks to a time wasting appeal, courtesy Parthiv. The back foot never left the crease after Rabada's failed attempt tof getting bat on ball with his waft. A moment of praise for the umpires - spots and declines ",DC Inns,25t,Mumbai Indians,Delhi Capitals,"Mumbai Indians (Playing XI): Parthiv Patel(w), Jos Buttler, Nitish Rana, Rohit Sharma(c), Hardik Pandya, Kieron Pollard, Krunal Pandya, Mitchell Johnson, Harbhajan Singh, Mitchell McClenaghan, Jasprit Bumrah",,,,IPL,2017,"Wankhede Stadium,Mumbai","Apr 22,2017",Delhi Daredevils have won the toss and have opted to field,Mumbai Indians won by 14 runs,Mitchell McClenaghan,DD,field
 11.4 ," Harbhajan to Rabada, no run, spot on. A scooter off the track with the ball straying on with the arm. Rabada stands behind deep looking to play for the turn. Gets none ",DC Inns,25t,Mumbai Indians,Delhi Capitals,"Mumbai Indians (Playing XI): Parthiv Patel(w), Jos Buttler, Nitish Rana, Rohit Sharma(c), Hardik Pandya, Kieron Pollard, Krunal Pandya, Mitchell Johnson, Harbhajan Singh, Mitchell McClenaghan, Jasprit Bumrah",,,,IPL,2017,"Wankhede Stadium,Mumbai","Apr 22,2017",Delhi Daredevils have won the toss and have opted to field,Mumbai Indians won by 14 runs,Mitchell McClenaghan,DD,field
 11.3 ,"Harbhajan to Rabada, no run, a power in the form of a drive to extra cover",DC Inns,25t,Mumbai Indians,Delhi Capitals,"Mumbai Indians (Playing XI): Parthiv Patel(w), Jos Buttler, Nitish Rana, Rohit Sharma(c), Hardik Pandya, Kieron Pollard, Krunal Pandya, Mitchell Johnson, Harbhajan Singh, Mitchell McClenaghan, Jasprit Bumrah",,,,IPL,2017,"Wankhede Stadium,Mumbai","Apr 22,2017",Delhi Daredevils have won the toss and have opted to field,Mumbai Indians won by 14 runs,Mitchell McClenaghan,DD,field
 11.2 ," Harbhajan to Chris Morris, 1 run, a typical spinner response. Flat, quick and hammered down the ground ",DC Inns,25t,Mumbai Indians,Delhi Capitals,"Mumbai Indians (Playing XI): Parthiv Patel(w), Jos Buttler, Nitish Rana, Rohit Sharma(c), Hardik Pandya, Kieron Pollard, Krunal Pandya, Mitchell Johnson, Harbhajan Singh, Mitchell McClenaghan, Jasprit Bumrah",,,,IPL,2017,"Wankhede Stadium,Mumbai","Apr 22,2017",Delhi Daredevils have won the toss and have opted to field,Mumbai Indians won by 14 runs,Mitchell McClenaghan,DD,field
 11.1 ," Harbhajan to Rabada, 1 run, reverses his grip and sweeps it off the glove in imparting the direction. Very fine ",DC Inns,25t,Mumbai Indians,Delhi Capitals,"Mumbai Indians (Playing XI): Parthiv Patel(w), Jos Buttler, Nitish Rana, Rohit Sharma(c), Hardik Pandya, Kieron Pollard, Krunal Pandya, Mitchell Johnson, Harbhajan Singh, Mitchell McClenaghan, Jasprit Bumrah",,,,IPL,2017,"Wankhede Stadium,Mumbai","Apr 22,2017",Delhi Daredevils have won the toss and have opted to field,Mumbai Indians won by 14 runs,Mitchell McClenaghan,DD,field
 10.6 ," Bumrah to Rabada, 1 run, shuffles enough to get himself behind the line of the ball and knocks it down to long-on ",DC Inns,25t,Mumbai Indians,Delhi Capitals,"Mumbai Indians (Playing XI): Parthiv Patel(w), Jos Buttler, Nitish Rana, Rohit Sharma(c), Hardik Pandya, Kieron Pollard, Krunal Pandya, Mitchell Johnson, Harbhajan Singh, Mitchell McClenaghan, Jasprit Bumrah",,,,IPL,2017,"Wankhede Stadium,Mumbai","Apr 22,2017",Delhi Daredevils have won the toss and have opted to field,Mumbai Indians won by 14 runs,Mitchell McClenaghan,DD,field
 10.5 ," Bumrah to Rabada, no run, much tighter. Much fuller as well. Makes him settle for a block ",DC Inns,25t,Mumbai Indians,Delhi Capitals,"Mumbai Indians (Playing XI): Parthiv Patel(w), Jos Buttler, Nitish Rana, Rohit Sharma(c), Hardik Pandya, Kieron Pollard, Krunal Pandya, Mitchell Johnson, Harbhajan Singh, Mitchell McClenaghan, Jasprit Bumrah",,,,IPL,2017,"Wankhede Stadium,Mumbai","Apr 22,2017",Delhi Daredevils have won the toss and have opted to field,Mumbai Indians won by 14 runs,Mitchell McClenaghan,DD,field
 10.4 ," Bumrah to Rabada, FOUR, the French cut now. Rabada keeping the flag fluttering up there. Gets himself too close for the cut but swishes through. Chops it off the under edge past the keeper. So very French ",DC Inns,25t,Mumbai Indians,Delhi Capitals,"Mumbai Indians (Playing XI): Parthiv Patel(w), Jos Buttler, Nitish Rana, Rohit Sharma(c), Hardik Pandya, Kieron Pollard, Krunal Pandya, Mitchell Johnson, Harbhajan Singh, Mitchell McClenaghan, Jasprit Bumrah",,,,IPL,2017,"Wankhede Stadium,Mumbai","Apr 22,2017",Delhi Daredevils have won the toss and have opted to field,Mumbai Indians won by 14 runs,Mitchell McClenaghan,DD,field
 10.3 ," Bumrah to Rabada, FOUR, chipped up. Was a serious miscue. But pockets a boundary for his efforts. With no one at the fence, thanks to all the wickets falling around, Rabada lofts it uppishly off the cue end over mid-off. That's all he had to do ",DC Inns,25t,Mumbai Indians,Delhi Capitals,"Mumbai Indians (Playing XI): Parthiv Patel(w), Jos Buttler, Nitish Rana, Rohit Sharma(c), Hardik Pandya, Kieron Pollard, Krunal Pandya, Mitchell Johnson, Harbhajan Singh, Mitchell McClenaghan, Jasprit Bumrah",,,,IPL,2017,"Wankhede Stadium,Mumbai","Apr 22,2017",Delhi Daredevils have won the toss and have opted to field,Mumbai Indians won by 14 runs,Mitchell McClenaghan,DD,field
 10.2 ," Bumrah to Rabada, no run, the slower one. Barely at 111kph making Rabada wait as he cracks it to cover ",DC Inns,25t,Mumbai Indians,Delhi Capitals,"Mumbai Indians (Playing XI): Parthiv Patel(w), Jos Buttler, Nitish Rana, Rohit Sharma(c), Hardik Pandya, Kieron Pollard, Krunal Pandya, Mitchell Johnson, Harbhajan Singh, Mitchell McClenaghan, Jasprit Bumrah",,,,IPL,2017,"Wankhede Stadium,Mumbai","Apr 22,2017",Delhi Daredevils have won the toss and have opted to field,Mumbai Indians won by 14 runs,Mitchell McClenaghan,DD,field
 10.1 ," Bumrah to Chris Morris, 1 run, on a back of a length cutting in on the top of off. A pulling whack to keep long-on busy ",DC Inns,25t,Mumbai Indians,Delhi Capitals,"Mumbai Indians (Playing XI): Parthiv Patel(w), Jos Buttler, Nitish Rana, Rohit Sharma(c), Hardik Pandya, Kieron Pollard, Krunal Pandya, Mitchell Johnson, Harbhajan Singh, Mitchell McClenaghan, Jasprit Bumrah",,,,IPL,2017,"Wankhede Stadium,Mumbai","Apr 22,2017",Delhi Daredevils have won the toss and have opted to field,Mumbai Indians won by 14 runs,Mitchell McClenaghan,DD,field
 9.6 ," Harbhajan to Chris Morris, 1 run, a flat one fired in on the pads. Turned away around the corner ",DC Inns,25t,Mumbai Indians,Delhi Capitals,"Mumbai Indians (Playing XI): Parthiv Patel(w), Jos Buttler, Nitish Rana, Rohit Sharma(c), Hardik Pandya, Kieron Pollard, Krunal Pandya, Mitchell Johnson, Harbhajan Singh, Mitchell McClenaghan, Jasprit Bumrah",,,,IPL,2017,"Wankhede Stadium,Mumbai","Apr 22,2017",Delhi Daredevils have won the toss and have opted to field,Mumbai Indians won by 14 runs,Mitchell McClenaghan,DD,field
 9.5 ," Harbhajan to Rabada, 1 run, a nice crunch of the bat as he caresses it down to long-off ",DC Inns,25t,Mumbai Indians,Delhi Capitals,"Mumbai Indians (Playing XI): Parthiv Patel(w), Jos Buttler, Nitish Rana, Rohit Sharma(c), Hardik Pandya, Kieron Pollard, Krunal Pandya, Mitchell Johnson, Harbhajan Singh, Mitchell McClenaghan, Jasprit Bumrah",,,,IPL,2017,"Wankhede Stadium,Mumbai","Apr 22,2017",Delhi Daredevils have won the toss and have opted to field,Mumbai Indians won by 14 runs,Mitchell McClenaghan,DD,field
 9.4 ," Harbhajan to Rabada, SIX, a dance and a dispatch. Right up, close and personal to a friendly tosser up and excutes the lofted drive. Clears the tallest man on operation at long-off ",DC Inns,25t,Mumbai Indians,Delhi Capitals,"Mumbai Indians (Playing XI): Parthiv Patel(w), Jos Buttler, Nitish Rana, Rohit Sharma(c), Hardik Pandya, Kieron Pollard, Krunal Pandya, Mitchell Johnson, Harbhajan Singh, Mitchell McClenaghan, Jasprit Bumrah",,,,IPL,2017,"Wankhede Stadium,Mumbai","Apr 22,2017",Delhi Daredevils have won the toss and have opted to field,Mumbai Indians won by 14 runs,Mitchell McClenaghan,DD,field
 9.3 ," Harbhajan to Chris Morris, 1 run, does well to roll his wrists on the bounce as he sweeps it behind square. All too nonchalant ",DC Inns,25t,Mumbai Indians,Delhi Capitals,"Mumbai Indians (Playing XI): Parthiv Patel(w), Jos Buttler, Nitish Rana, Rohit Sharma(c), Hardik Pandya, Kieron Pollard, Krunal Pandya, Mitchell Johnson, Harbhajan Singh, Mitchell McClenaghan, Jasprit Bumrah",,,,IPL,2017,"Wankhede Stadium,Mumbai","Apr 22,2017",Delhi Daredevils have won the toss and have opted to field,Mumbai Indians won by 14 runs,Mitchell McClenaghan,DD,field
 9.2 ," Harbhajan to Chris Morris, no run, persists with the teasing line well outside off. An airy swing and a miss ",DC Inns,25t,Mumbai Indians,Delhi Capitals,"Mumbai Indians (Playing XI): Parthiv Patel(w), Jos Buttler, Nitish Rana, Rohit Sharma(c), Hardik Pandya, Kieron Pollard, Krunal Pandya, Mitchell Johnson, Harbhajan Singh, Mitchell McClenaghan, Jasprit Bumrah",,,,IPL,2017,"Wankhede Stadium,Mumbai","Apr 22,2017",Delhi Daredevils have won the toss and have opted to field,Mumbai Indians won by 14 runs,Mitchell McClenaghan,DD,field
 9.1 ," Harbhajan to Chris Morris, FOUR, would need many more of these. A wide liner this from Bhajji and Morris capitalizes with a reverse as he brooms it past the lone man perched at point ",DC Inns,25t,Mumbai Indians,Delhi Capitals,"Mumbai Indians (Playing XI): Parthiv Patel(w), Jos Buttler, Nitish Rana, Rohit Sharma(c), Hardik Pandya, Kieron Pollard, Krunal Pandya, Mitchell Johnson, Harbhajan Singh, Mitchell McClenaghan, Jasprit Bumrah",,,,IPL,2017,"Wankhede Stadium,Mumbai","Apr 22,2017",Delhi Daredevils have won the toss and have opted to field,Mumbai Indians won by 14 runs,Mitchell McClenaghan,DD,field
 8.6 ," Hardik Pandya to Chris Morris, 1 run, keeps up with the dragged back length. An across the line heave follows in stroking it to a sliding long-on ",DC Inns,25t,Mumbai Indians,Delhi Capitals,"Mumbai Indians (Playing XI): Parthiv Patel(w), Jos Buttler, Nitish Rana, Rohit Sharma(c), Hardik Pandya, Kieron Pollard, Krunal Pandya, Mitchell Johnson, Harbhajan Singh, Mitchell McClenaghan, Jasprit Bumrah",,,,IPL,2017,"Wankhede Stadium,Mumbai","Apr 22,2017",Delhi Daredevils have won the toss and have opted to field,Mumbai Indians won by 14 runs,Mitchell McClenaghan,DD,field
 8.5 ," Hardik Pandya to Rabada, 1 run, short, slanting across. Crashed away through point ",DC Inns,25t,Mumbai Indians,Delhi Capitals,"Mumbai Indians (Playing XI): Parthiv Patel(w), Jos Buttler, Nitish Rana, Rohit Sharma(c), Hardik Pandya, Kieron Pollard, Krunal Pandya, Mitchell Johnson, Harbhajan Singh, Mitchell McClenaghan, Jasprit Bumrah",,,,IPL,2017,"Wankhede Stadium,Mumbai","Apr 22,2017",Delhi Daredevils have won the toss and have opted to field,Mumbai Indians won by 14 runs,Mitchell McClenaghan,DD,field
 8.4 ," Hardik Pandya to Rabada, FOUR, oh glorious. As clean as it could get. A pitched up delivery in the arc and Rabada gives his top order a facepalm moment with a full bat face presentation. Whizzes past the bowler ",DC Inns,25t,Mumbai Indians,Delhi Capitals,"Mumbai Indians (Playing XI): Parthiv Patel(w), Jos Buttler, Nitish Rana, Rohit Sharma(c), Hardik Pandya, Kieron Pollard, Krunal Pandya, Mitchell Johnson, Harbhajan Singh, Mitchell McClenaghan, Jasprit Bumrah",,,,IPL,2017,"Wankhede Stadium,Mumbai","Apr 22,2017",Delhi Daredevils have won the toss and have opted to field,Mumbai Indians won by 14 runs,Mitchell McClenaghan,DD,field
 8.4 ," Hardik Pandya to Rabada, wide, too much of the venom. Bangs it in short does Pandya with the ball gaining in altitude as it flies through to the keeper ",DC Inns,25t,Mumbai Indians,Delhi Capitals,"Mumbai Indians (Playing XI): Parthiv Patel(w), Jos Buttler, Nitish Rana, Rohit Sharma(c), Hardik Pandya, Kieron Pollard, Krunal Pandya, Mitchell Johnson, Harbhajan Singh, Mitchell McClenaghan, Jasprit Bumrah",,,,IPL,2017,"Wankhede Stadium,Mumbai","Apr 22,2017",Delhi Daredevils have won the toss and have opted to field,Mumbai Indians won by 14 runs,Mitchell McClenaghan,DD,field
 8.3 ," Hardik Pandya to Rabada, 2 runs, cramped up. Stands up for the pull but the ball is hardly in the zone for the arms to be freed up. Rabada nevertheless swings through keeping the bat flat as he smashes it back past the bowler ",DC Inns,25t,Mumbai Indians,Delhi Capitals,"Mumbai Indians (Playing XI): Parthiv Patel(w), Jos Buttler, Nitish Rana, Rohit Sharma(c), Hardik Pandya, Kieron Pollard, Krunal Pandya, Mitchell Johnson, Harbhajan Singh, Mitchell McClenaghan, Jasprit Bumrah",,,,IPL,2017,"Wankhede Stadium,Mumbai","Apr 22,2017",Delhi Daredevils have won the toss and have opted to field,Mumbai Indians won by 14 runs,Mitchell McClenaghan,DD,field
 8.2 ," Hardik Pandya to Chris Morris, 1 run, goes hard on the drive to mid-off and takes him on. Only just. A direct hit could have meant curtains. Just that was none ",DC Inns,25t,Mumbai Indians,Delhi Capitals,"Mumbai Indians (Playing XI): Parthiv Patel(w), Jos Buttler, Nitish Rana, Rohit Sharma(c), Hardik Pandya, Kieron Pollard, Krunal Pandya, Mitchell Johnson, Harbhajan Singh, Mitchell McClenaghan, Jasprit Bumrah",,,,IPL,2017,"Wankhede Stadium,Mumbai","Apr 22,2017",Delhi Daredevils have won the toss and have opted to field,Mumbai Indians won by 14 runs,Mitchell McClenaghan,DD,field
 8.1 ," Hardik Pandya to Chris Morris, no run, on a good length around the fourth stump line. A forward press with a push to mid-off ",DC Inns,25t,Mumbai Indians,Delhi Capitals,"Mumbai Indians (Playing XI): Parthiv Patel(w), Jos Buttler, Nitish Rana, Rohit Sharma(c), Hardik Pandya, Kieron Pollard, Krunal Pandya, Mitchell Johnson, Harbhajan Singh, Mitchell McClenaghan, Jasprit Bumrah",,,,IPL,2017,"Wankhede Stadium,Mumbai","Apr 22,2017",Delhi Daredevils have won the toss and have opted to field,Mumbai Indians won by 14 runs,Mitchell McClenaghan,DD,field
 7.6 ," Harbhajan to Rabada, FOUR, almost another. Rabada after getting squared up thanks to the nagging angle being created out here just throws his bat up looking to cut the ball away. Races away off the top-edge and flies through the hands of slip. Rohit the man out there. Too quick for the classification to come under a drop ",DC Inns,25t,Mumbai Indians,Delhi Capitals,"Mumbai Indians (Playing XI): Parthiv Patel(w), Jos Buttler, Nitish Rana, Rohit Sharma(c), Hardik Pandya, Kieron Pollard, Krunal Pandya, Mitchell Johnson, Harbhajan Singh, Mitchell McClenaghan, Jasprit Bumrah",,,,IPL,2017,"Wankhede Stadium,Mumbai","Apr 22,2017",Delhi Daredevils have won the toss and have opted to field,Mumbai Indians won by 14 runs,Mitchell McClenaghan,DD,field
 7.5 ," Harbhajan to Chris Morris, 1 run, nice transfer of weight forward with the bat keen on being vertical as Morris knocks it down the ground ",DC Inns,25t,Mumbai Indians,Delhi Capitals,"Mumbai Indians (Playing XI): Parthiv Patel(w), Jos Buttler, Nitish Rana, Rohit Sharma(c), Hardik Pandya, Kieron Pollard, Krunal Pandya, Mitchell Johnson, Harbhajan Singh, Mitchell McClenaghan, Jasprit Bumrah",,,,IPL,2017,"Wankhede Stadium,Mumbai","Apr 22,2017",Delhi Daredevils have won the toss and have opted to field,Mumbai Indians won by 14 runs,Mitchell McClenaghan,DD,field
 7.4 ," Harbhajan to Chris Morris, no run, rips up, with the ball sticking onto the surface. Awkwardly nudged away. Almost lobs it over to the keeper ",DC Inns,25t,Mumbai Indians,Delhi Capitals,"Mumbai Indians (Playing XI): Parthiv Patel(w), Jos Buttler, Nitish Rana, Rohit Sharma(c), Hardik Pandya, Kieron Pollard, Krunal Pandya, Mitchell Johnson, Harbhajan Singh, Mitchell McClenaghan, Jasprit Bumrah",,,,IPL,2017,"Wankhede Stadium,Mumbai","Apr 22,2017",Delhi Daredevils have won the toss and have opted to field,Mumbai Indians won by 14 runs,Mitchell McClenaghan,DD,field
 7.3 ," Harbhajan to Chris Morris, no run, looks to maximize the spin with a sink outside the line of off as he looks to sweep it away. Finds the man at 45 behind square ",DC Inns,25t,Mumbai Indians,Delhi Capitals,"Mumbai Indians (Playing XI): Parthiv Patel(w), Jos Buttler, Nitish Rana, Rohit Sharma(c), Hardik Pandya, Kieron Pollard, Krunal Pandya, Mitchell Johnson, Harbhajan Singh, Mitchell McClenaghan, Jasprit Bumrah",,,,IPL,2017,"Wankhede Stadium,Mumbai","Apr 22,2017",Delhi Daredevils have won the toss and have opted to field,Mumbai Indians won by 14 runs,Mitchell McClenaghan,DD,field
 7.2 ," Harbhajan to Chris Morris, no run, nice drift taking it on off. A stern push back to the bowler with the bat and pad in close proximity ",DC Inns,25t,Mumbai Indians,Delhi Capitals,"Mumbai Indians (Playing XI): Parthiv Patel(w), Jos Buttler, Nitish Rana, Rohit Sharma(c), Hardik Pandya, Kieron Pollard, Krunal Pandya, Mitchell Johnson, Harbhajan Singh, Mitchell McClenaghan, Jasprit Bumrah",,,,IPL,2017,"Wankhede Stadium,Mumbai","Apr 22,2017",Delhi Daredevils have won the toss and have opted to field,Mumbai Indians won by 14 runs,Mitchell McClenaghan,DD,field
 7.1 ," Harbhajan to Rabada, 1 run, short, turning away. Gets the full bat face as it is punched away to sweeper ",DC Inns,25t,Mumbai Indians,Delhi Capitals,"Mumbai Indians (Playing XI): Parthiv Patel(w), Jos Buttler, Nitish Rana, Rohit Sharma(c), Hardik Pandya, Kieron Pollard, Krunal Pandya, Mitchell Johnson, Harbhajan Singh, Mitchell McClenaghan, Jasprit Bumrah",,,,IPL,2017,"Wankhede Stadium,Mumbai","Apr 22,2017",Delhi Daredevils have won the toss and have opted to field,Mumbai Indians won by 14 runs,Mitchell McClenaghan,DD,field
 6.6 ," Hardik Pandya to Chris Morris, 2 runs, back of a length just outside off, Morris stands tall and punches it to deep cover. The sweeper runs across and keeps it to a brace ",DC Inns,25t,Mumbai Indians,Delhi Capitals,"Mumbai Indians (Playing XI): Parthiv Patel(w), Jos Buttler, Nitish Rana, Rohit Sharma(c), Hardik Pandya, Kieron Pollard, Krunal Pandya, Mitchell Johnson, Harbhajan Singh, Mitchell McClenaghan, Jasprit Bumrah",,,,IPL,2017,"Wankhede Stadium,Mumbai","Apr 22,2017",Delhi Daredevils have won the toss and have opted to field,Mumbai Indians won by 14 runs,Mitchell McClenaghan,DD,field
 6.5 ," Hardik Pandya to Rabada, 1 run, short of length on middle, Rabada tucks it towards short mid-wicket and takes off. Hardik runs across and fails to collect the ball, single taken easily ",DC Inns,25t,Mumbai Indians,Delhi Capitals,"Mumbai Indians (Playing XI): Parthiv Patel(w), Jos Buttler, Nitish Rana, Rohit Sharma(c), Hardik Pandya, Kieron Pollard, Krunal Pandya, Mitchell Johnson, Harbhajan Singh, Mitchell McClenaghan, Jasprit Bumrah",,,,IPL,2017,"Wankhede Stadium,Mumbai","Apr 22,2017",Delhi Daredevils have won the toss and have opted to field,Mumbai Indians won by 14 runs,Mitchell McClenaghan,DD,field
 6.4 ," Hardik Pandya to Chris Morris, byes, 1 run, good length ball curling away outside off, Morris shoulders arms. Parthiv doesn't glove it cleanly and the South Africans steal a quick run ",DC Inns,25t,Mumbai Indians,Delhi Capitals,"Mumbai Indians (Playing XI): Parthiv Patel(w), Jos Buttler, Nitish Rana, Rohit Sharma(c), Hardik Pandya, Kieron Pollard, Krunal Pandya, Mitchell Johnson, Harbhajan Singh, Mitchell McClenaghan, Jasprit Bumrah",,,,IPL,2017,"Wankhede Stadium,Mumbai","Apr 22,2017",Delhi Daredevils have won the toss and have opted to field,Mumbai Indians won by 14 runs,Mitchell McClenaghan,DD,field
 6.3 ," Hardik Pandya to Nair, out Bowled!! Chopped on! Hardik is into the act now. Six down and just the 24 on the board. Nair becomes the sixth batsmen to record a single-digit score. This is getting embarrassing for DD. Short of a length and just outside off, Nair goes half-hearted on the cut shot, the inside edge crashes into the stumps. No respite for the crowd, they keep going bonkers each over. Nair b Hardik Pandya 5(15) ",DC Inns,25t,Mumbai Indians,Delhi Capitals,"Mumbai Indians (Playing XI): Parthiv Patel(w), Jos Buttler, Nitish Rana, Rohit Sharma(c), Hardik Pandya, Kieron Pollard, Krunal Pandya, Mitchell Johnson, Harbhajan Singh, Mitchell McClenaghan, Jasprit Bumrah",,,,IPL,2017,"Wankhede Stadium,Mumbai","Apr 22,2017",Delhi Daredevils have won the toss and have opted to field,Mumbai Indians won by 14 runs,Mitchell McClenaghan,DD,field
 6.2 ," Hardik Pandya to Nair, no run, peach! Even Hardik getting the ball to talk. Nair was opened up and left gropping for the ball. Back of a length and around off, Nair has to play at that and the ball straightens to beat the outside edge ",DC Inns,25t,Mumbai Indians,Delhi Capitals,"Mumbai Indians (Playing XI): Parthiv Patel(w), Jos Buttler, Nitish Rana, Rohit Sharma(c), Hardik Pandya, Kieron Pollard, Krunal Pandya, Mitchell Johnson, Harbhajan Singh, Mitchell McClenaghan, Jasprit Bumrah",,,,IPL,2017,"Wankhede Stadium,Mumbai","Apr 22,2017",Delhi Daredevils have won the toss and have opted to field,Mumbai Indians won by 14 runs,Mitchell McClenaghan,DD,field
